{
  "schemaVersion": 1,
  "project": "pixel_canvas",
  "createdAt": "2026-04-27T09:08:07.745Z",
  "updatedAt": "2026-04-27T09:50:21.400Z",
  "currentPhase": "done",
  "phases": {
    "understand": {
      "status": "completed",
      "finishedAt": "2026-04-27T09:08:15.979Z"
    },
    "prd": {
      "status": "completed",
      "finishedAt": "2026-04-27T09:13:47.734Z"
    },
    "expand": {
      "status": "completed",
      "subtasks": {
        "mechanics": {
          "status": "completed",
          "finishedAt": "2026-04-27T09:21:14.800Z",
          "output": "specs/.pending/mechanics.yaml"
        },
        "scene": {
          "status": "completed",
          "finishedAt": "2026-04-27T09:26:14.178Z",
          "output": "specs/.pending/scene.yaml"
        },
        "rule": {
          "status": "completed",
          "finishedAt": "2026-04-27T09:26:14.179Z",
          "output": "specs/.pending/rule.yaml"
        },
        "data": {
          "status": "completed",
          "finishedAt": "2026-04-27T09:26:14.179Z",
          "output": "specs/.pending/data.yaml"
        },
        "assets": {
          "status": "completed",
          "finishedAt": "2026-04-27T09:26:14.179Z",
          "output": "specs/.pending/assets.yaml"
        },
        "event-graph": {
          "status": "completed",
          "finishedAt": "2026-04-27T09:26:14.179Z",
          "output": "specs/.pending/event-graph.yaml"
        },
        "implementation-contract": {
          "status": "completed",
          "finishedAt": "2026-04-27T09:26:28.823Z",
          "output": "specs/.pending/implementation-contract.yaml"
        }
      },
      "startedAt": "2026-04-27T09:17:12.324Z",
      "attempts": 1,
      "finishedAt": "2026-04-27T09:26:57.065Z",
      "outputs": [
        "specs/mechanics.yaml",
        "specs/scene.yaml",
        "specs/rule.yaml",
        "specs/data.yaml",
        "specs/assets.yaml",
        "specs/event-graph.yaml",
        "specs/implementation-contract.yaml"
      ]
    },
    "codegen": {
      "status": "completed",
      "finishedAt": "2026-04-27T09:46:34.436Z"
    },
    "verify": {
      "status": "completed",
      "profileSha": "9b6874c5a88cd50559b960be6148b2ea764dd81e5723e7dc16c87b2398c597c3",
      "profilePath": "/Users/bytedance/Project/game_skill/game_skill/skills/scripts/profiles/pixel_canvas-001.json",
      "finishedAt": "2026-04-27T09:50:21.399Z"
    }
  },
  "runtime": "canvas",
  "completedAt": "2026-04-27T09:50:21.399Z"
}
