{
  "schemaVersion": 1,
  "project": "pixel_pixijs",
  "createdAt": "2026-04-27T09:03:06.464Z",
  "updatedAt": "2026-04-27T09:44:26.981Z",
  "currentPhase": "done",
  "phases": {
    "understand": {
      "status": "completed",
      "finishedAt": "2026-04-27T09:08:33.658Z"
    },
    "prd": {
      "status": "completed",
      "finishedAt": "2026-04-27T09:11:23.551Z",
      "runtime": "pixijs"
    },
    "expand": {
      "status": "completed",
      "subtasks": {
        "mechanics": {
          "status": "completed",
          "finishedAt": "2026-04-27T09:16:02.183Z",
          "output": "specs/.pending/mechanics.yaml"
        },
        "scene": {
          "status": "completed",
          "finishedAt": "2026-04-27T09:16:02.183Z",
          "output": "specs/.pending/scene.yaml"
        },
        "rule": {
          "status": "completed",
          "finishedAt": "2026-04-27T09:16:02.183Z",
          "output": "specs/.pending/rule.yaml"
        },
        "data": {
          "status": "completed",
          "finishedAt": "2026-04-27T09:16:02.183Z",
          "output": "specs/.pending/data.yaml"
        },
        "assets": {
          "status": "completed",
          "finishedAt": "2026-04-27T09:16:02.183Z",
          "output": "specs/.pending/assets.yaml"
        },
        "event-graph": {
          "status": "completed",
          "finishedAt": "2026-04-27T09:16:02.183Z",
          "output": "specs/.pending/event-graph.yaml"
        },
        "implementation-contract": {
          "status": "completed",
          "finishedAt": "2026-04-27T09:26:22.051Z",
          "output": "specs/implementation-contract.yaml"
        }
      },
      "startedAt": "2026-04-27T09:12:12.677Z",
      "attempts": 1,
      "finishedAt": "2026-04-27T09:26:22.052Z",
      "outputs": [
        "specs/mechanics.yaml",
        "specs/scene.yaml",
        "specs/rule.yaml",
        "specs/data.yaml",
        "specs/assets.yaml",
        "specs/event-graph.yaml",
        "specs/implementation-contract.yaml"
      ]
    },
    "codegen": {
      "status": "completed",
      "finishedAt": "2026-04-27T09:36:54.708Z"
    },
    "verify": {
      "status": "completed",
      "startedAt": "2026-04-27T09:36:54.709Z",
      "attempts": 1,
      "profileSha": "5fb00c7fb4ccb6b28e41319dd0153a109a84e90f0d49c77846c94b9b83a8291b",
      "profilePath": "/Users/bytedance/Project/game_skill/game_skill/skills/scripts/profiles/pixel_pixijs.json",
      "finishedAt": "2026-04-27T09:44:26.980Z"
    }
  },
  "runtime": "pixijs",
  "completedAt": "2026-04-27T09:44:26.980Z"
}
