{
  "schemaVersion": 1,
  "project": "pixel_dom_ui",
  "createdAt": "2026-04-27T09:03:25.388Z",
  "updatedAt": "2026-04-27T09:52:57.092Z",
  "currentPhase": "done",
  "phases": {
    "understand": {
      "status": "completed",
      "finishedAt": "2026-04-27T09:08:07.745Z"
    },
    "prd": {
      "status": "completed",
      "finishedAt": "2026-04-27T09:12:33.739Z"
    },
    "expand": {
      "status": "completed",
      "subtasks": {
        "mechanics": {
          "status": "completed",
          "finishedAt": "2026-04-27T09:22:28.990Z",
          "output": "specs/mechanics.yaml"
        },
        "scene": {
          "status": "completed",
          "finishedAt": "2026-04-27T09:22:28.991Z",
          "output": "specs/scene.yaml"
        },
        "rule": {
          "status": "completed",
          "finishedAt": "2026-04-27T09:22:28.991Z",
          "output": "specs/rule.yaml"
        },
        "data": {
          "status": "completed",
          "finishedAt": "2026-04-27T09:22:28.991Z",
          "output": "specs/data.yaml"
        },
        "assets": {
          "status": "completed",
          "finishedAt": "2026-04-27T09:22:28.991Z",
          "output": "specs/assets.yaml"
        },
        "event-graph": {
          "status": "completed",
          "finishedAt": "2026-04-27T09:22:28.991Z",
          "output": "specs/event-graph.yaml"
        },
        "implementation-contract": {
          "status": "completed",
          "finishedAt": "2026-04-27T09:22:28.991Z",
          "output": "specs/implementation-contract.yaml"
        }
      },
      "startedAt": "2026-04-27T09:17:06.304Z",
      "attempts": 1,
      "finishedAt": "2026-04-27T09:25:28.251Z",
      "outputs": [
        "specs/mechanics.yaml",
        "specs/scene.yaml",
        "specs/rule.yaml",
        "specs/data.yaml",
        "specs/assets.yaml",
        "specs/event-graph.yaml",
        "specs/implementation-contract.yaml"
      ]
    },
    "codegen": {
      "status": "completed",
      "finishedAt": "2026-04-27T09:50:39.173Z"
    },
    "verify": {
      "status": "completed",
      "profileSha": "33f6ba5a1607ddc6bbf3711a473f09f04207d92a0a99a246546cbdeac7a827c4",
      "profilePath": "/Users/bytedance/Project/game_skill/game_skill/skills/scripts/profiles/pixel_dom_ui.json",
      "finishedAt": "2026-04-27T09:52:57.090Z"
    }
  },
  "runtime": "dom-ui",
  "completedAt": "2026-04-27T09:52:57.090Z"
}
